{
  "$schema": "https://ta_lab2.local/schemas/reorganization-decisions/v1.0.0",
  "version": "1.0.0",
  "created_at": "2026-02-04T00:18:23Z",
  "phase_range": {
    "start": 11,
    "end": 17
  },
  "decisions": [
    {
      "id": "DEC-001",
      "type": "archive",
      "source": "ProjectTT/*.docx",
      "destination": ".archive/documentation/2026-02-02/",
      "phase": 13,
      "timestamp": "2026-02-02T21:41:22Z",
      "category": "documentation",
      "action": "Archive original DOCX files after Markdown conversion",
      "rationale_id": "RAT-001",
      "related_decisions": ["DEC-002"],
      "requirements": ["DOC-01", "DOC-02"],
      "file_count": 62,
      "commit_hash": "e0470cb"
    },
    {
      "id": "DEC-002",
      "type": "convert",
      "source": "ProjectTT/*.docx",
      "destination": "docs/*/*.md",
      "phase": 13,
      "timestamp": "2026-02-02T21:30:00Z",
      "category": "documentation",
      "action": "Convert DOCX to Markdown using pypandoc and markdownify",
      "rationale_id": "RAT-001",
      "related_decisions": ["DEC-001"],
      "requirements": ["DOC-01"],
      "file_count": 62
    },
    {
      "id": "DEC-003",
      "type": "create",
      "source": "N/A",
      "destination": ".archive/{category}/YYYY-MM-DD/",
      "phase": 12,
      "timestamp": "2026-02-02T20:00:00Z",
      "category": "archive-infrastructure",
      "action": "Create category-first archive structure",
      "rationale_id": "RAT-002",
      "related_decisions": ["DEC-004", "DEC-005"],
      "requirements": ["ARCH-01"],
      "file_count": 0
    },
    {
      "id": "DEC-004",
      "type": "create",
      "source": "N/A",
      "destination": ".archive/{category}/manifest.json",
      "phase": 12,
      "timestamp": "2026-02-02T20:15:00Z",
      "category": "archive-infrastructure",
      "action": "Create manifest per category with $schema versioning",
      "rationale_id": "RAT-003",
      "related_decisions": ["DEC-003"],
      "requirements": ["ARCH-02"],
      "file_count": 0
    },
    {
      "id": "DEC-005",
      "type": "create",
      "source": "N/A",
      "destination": "manifest checksums",
      "phase": 12,
      "timestamp": "2026-02-02T20:30:00Z",
      "category": "archive-infrastructure",
      "action": "Use SHA256 checksums for file validation",
      "rationale_id": "RAT-004",
      "related_decisions": ["DEC-004"],
      "requirements": ["ARCH-03"],
      "file_count": 0
    },
    {
      "id": "DEC-006",
      "type": "migrate",
      "source": "Data_Tools/chatgpt/*.py",
      "destination": "src/ta_lab2/tools/data_tools/export/",
      "phase": 14,
      "timestamp": "2026-02-03T01:30:00Z",
      "category": "data-tools",
      "action": "Migrate ChatGPT export tools to export category",
      "rationale_id": "RAT-005",
      "related_decisions": ["DEC-011"],
      "requirements": ["TOOL-01", "TOOL-02"],
      "file_count": 6
    },
    {
      "id": "DEC-007",
      "type": "migrate",
      "source": "Data_Tools/*.py (analysis)",
      "destination": "src/ta_lab2/tools/data_tools/analysis/",
      "phase": 14,
      "timestamp": "2026-02-03T01:45:00Z",
      "category": "data-tools",
      "action": "Migrate AST and tree analysis tools",
      "rationale_id": "RAT-005",
      "related_decisions": ["DEC-006"],
      "requirements": ["TOOL-01"],
      "file_count": 8
    },
    {
      "id": "DEC-008",
      "type": "migrate",
      "source": "Data_Tools/*.py (memory)",
      "destination": "src/ta_lab2/tools/data_tools/memory/",
      "phase": 14,
      "timestamp": "2026-02-03T02:00:00Z",
      "category": "data-tools",
      "action": "Migrate embedding and OpenAI memory tools",
      "rationale_id": "RAT-005",
      "related_decisions": ["DEC-006"],
      "requirements": ["TOOL-01"],
      "file_count": 10
    },
    {
      "id": "DEC-009",
      "type": "migrate",
      "source": "Data_Tools/*.py (processing)",
      "destination": "src/ta_lab2/tools/data_tools/processing/",
      "phase": 14,
      "timestamp": "2026-02-03T02:15:00Z",
      "category": "data-tools",
      "action": "Migrate DataFrame and data processing utilities",
      "rationale_id": "RAT-005",
      "related_decisions": ["DEC-006"],
      "requirements": ["TOOL-01"],
      "file_count": 8
    },
    {
      "id": "DEC-010",
      "type": "migrate",
      "source": "Data_Tools/*.py (context/generators)",
      "destination": "src/ta_lab2/tools/data_tools/{context,generators}/",
      "phase": 14,
      "timestamp": "2026-02-03T02:30:00Z",
      "category": "data-tools",
      "action": "Migrate RAG reasoning and report generation tools",
      "rationale_id": "RAT-005",
      "related_decisions": ["DEC-006"],
      "requirements": ["TOOL-01"],
      "file_count": 8
    },
    {
      "id": "DEC-011",
      "type": "archive",
      "source": "Data_Tools/*.py (prototypes/one-offs)",
      "destination": ".archive/data_tools/2026-02-03/",
      "phase": 14,
      "timestamp": "2026-02-03T02:46:05Z",
      "category": "data-tools",
      "action": "Archive prototype scripts and simple wrappers",
      "rationale_id": "RAT-006",
      "related_decisions": ["DEC-006"],
      "requirements": ["TOOL-03"],
      "file_count": 13
    },
    {
      "id": "DEC-012",
      "type": "archive",
      "source": "fredtools2/**/*",
      "destination": ".archive/external-packages/2026-02-03/fredtools2/",
      "phase": 15,
      "timestamp": "2026-02-03T13:10:09Z",
      "category": "external-packages",
      "action": "Archive fredtools2 package (zero usage, ecosystem alternatives)",
      "rationale_id": "RAT-007",
      "related_decisions": ["DEC-013"],
      "requirements": ["ECON-01"],
      "file_count": 13
    },
    {
      "id": "DEC-013",
      "type": "archive",
      "source": "fedtools2/**/*",
      "destination": ".archive/external-packages/2026-02-03/fedtools2/",
      "phase": 15,
      "timestamp": "2026-02-03T13:10:09Z",
      "category": "external-packages",
      "action": "Archive fedtools2 package (zero usage, ecosystem alternatives)",
      "rationale_id": "RAT-007",
      "related_decisions": ["DEC-012"],
      "requirements": ["ECON-01"],
      "file_count": 29
    },
    {
      "id": "DEC-014",
      "type": "create",
      "source": "N/A",
      "destination": "src/ta_lab2/integrations/economic/",
      "phase": 15,
      "timestamp": "2026-02-03T12:00:00Z",
      "category": "economic-data",
      "action": "Create provider pattern for economic data sources",
      "rationale_id": "RAT-008",
      "related_decisions": ["DEC-012", "DEC-013"],
      "requirements": ["ECON-02"],
      "file_count": 0
    },
    {
      "id": "DEC-015",
      "type": "create",
      "source": "N/A",
      "destination": ".archive/external-packages/ALTERNATIVES.md",
      "phase": 15,
      "timestamp": "2026-02-03T13:00:00Z",
      "category": "external-packages",
      "action": "Document ecosystem alternatives for archived packages",
      "rationale_id": "RAT-009",
      "related_decisions": ["DEC-012", "DEC-013"],
      "requirements": ["ECON-03"],
      "file_count": 0
    },
    {
      "id": "DEC-016",
      "type": "create",
      "source": "N/A",
      "destination": ".planning/phases/{NN-name}/",
      "phase": 11,
      "timestamp": "2026-02-02T10:00:00Z",
      "category": "memory-infrastructure",
      "action": "Create memory-first reorganization tracking structure",
      "rationale_id": "RAT-010",
      "related_decisions": [],
      "requirements": ["MEM-01"],
      "file_count": 0
    },
    {
      "id": "DEC-017",
      "type": "create",
      "source": "N/A",
      "destination": "snapshot memories in Mem0",
      "phase": 11,
      "timestamp": "2026-02-02T11:00:00Z",
      "category": "memory-infrastructure",
      "action": "Snapshot project state with dual tagging strategy",
      "rationale_id": "RAT-011",
      "related_decisions": ["DEC-016"],
      "requirements": ["MEM-02"],
      "file_count": 0
    },
    {
      "id": "DEC-018",
      "type": "create",
      "source": "N/A",
      "destination": "80% queryability threshold",
      "phase": 11,
      "timestamp": "2026-02-02T12:00:00Z",
      "category": "memory-infrastructure",
      "action": "Establish weighted coverage calculation for memory baseline",
      "rationale_id": "RAT-012",
      "related_decisions": ["DEC-017"],
      "requirements": ["MEM-03"],
      "file_count": 0
    },
    {
      "id": "DEC-019",
      "type": "refactor",
      "source": "src/ta_lab2/tools/ema_runners.py",
      "destination": "src/ta_lab2/scripts/emas/ema_runners.py",
      "phase": 17,
      "timestamp": "2026-02-03T20:00:00Z",
      "category": "layering-fix",
      "action": "Move ema_runners from tools to scripts layer",
      "rationale_id": "RAT-013",
      "related_decisions": ["DEC-020"],
      "requirements": ["LAY-01"],
      "file_count": 1
    },
    {
      "id": "DEC-020",
      "type": "refactor",
      "source": "src/ta_lab2/regimes/run_btc_pipeline.py",
      "destination": "src/ta_lab2/scripts/pipelines/run_btc_pipeline.py",
      "phase": 17,
      "timestamp": "2026-02-03T21:00:00Z",
      "category": "layering-fix",
      "action": "Move pipeline CLI from regimes to scripts layer",
      "rationale_id": "RAT-013",
      "related_decisions": ["DEC-019"],
      "requirements": ["LAY-02"],
      "file_count": 1
    },
    {
      "id": "DEC-021",
      "type": "create",
      "source": "N/A",
      "destination": ".pre-commit-config.yaml",
      "phase": 17,
      "timestamp": "2026-02-03T18:00:00Z",
      "category": "quality-infrastructure",
      "action": "Create pre-commit hooks with .archive/ exclusion",
      "rationale_id": "RAT-014",
      "related_decisions": [],
      "requirements": ["QA-01"],
      "file_count": 0
    },
    {
      "id": "DEC-022",
      "type": "create",
      "source": "N/A",
      "destination": ".github/workflows/import-validation.yml",
      "phase": 17,